{
  "connectorId": "microsoft-graph-entra-readonly",
  "provider": "microsoft-graph",
  "tenantBoundary": "microsoft-graph:tenant:8c2c7d9b6df4f26b",
  "synthetic": false,
  "identity": {
    "kind": "service_principal",
    "subject": "connector:microsoft-graph-entra-readonly:8c2c7d9b6df4f26b",
    "evidence": ["docs/connector-contract.md", "adrs/0006-connector-plugin-architecture.md"]
  },
  "consent": {
    "status": "approved",
    "scopesApproved": ["User.Read.All", "GroupMember.Read.All", "Application.Read.All"],
    "evidence": ["docs/connector-contract.md", "docs/security-model.md"]
  },
  "leastPrivilege": {
    "requiredReadScopes": ["User.Read.All", "GroupMember.Read.All", "Application.Read.All"],
    "forbiddenWriteScopes": [
      "User.ReadWrite.All",
      "Group.ReadWrite.All",
      "GroupMember.ReadWrite.All",
      "Application.ReadWrite.All",
      "AppRoleAssignment.ReadWrite.All",
      "Directory.ReadWrite.All"
    ],
    "scopeJustification": "User, group membership, and application read scopes are sufficient for redacted Entra inventory, membership, service-principal, and app-role assignment readback without provider writes."
  },
  "operations": {
    "pagination": "required",
    "throttling": "required",
    "deletion": "mark_deleted",
    "coverageWarnings": "required",
    "nativeAccessReadback": true
  },
  "secrets": {
    "storesSecrets": false,
    "handling": "vault_required",
    "rotation": "required",
    "evidence": ["docs/connector-contract.md", "docs/security-model.md", "adrs/0009-secret-management.md", "runbooks/compromised-connector-credential.md"]
  },
  "enforcement": {
    "liveWritesAllowed": false,
    "controlledSyntheticOnly": false,
    "readinessRequired": true,
    "rollbackRequired": true,
    "emergencyRevocationRequired": true,
    "monitoringRequired": true
  }
}
